{
  "credentialGeneration": 1,
  "accountGeneration": 1,
  "policyVersion": 1,
  "profileVersion": 1,
  "limitPolicyVersion": 1,
  "symbol": "SPY",
  "side": "BUY",
  "quantity": "0.1",
  "limitPrice": "600.00",
  "orderType": "LIMIT",
  "timeInForce": "DAY",
  "session": "REGULAR",
  "currency": "USD",
  "expiresAt": "2026-10-20T10:01:00Z",
  "budgetVersion": 1,
  "riskBudget": "100",
  "proposalId": "12345678-1234-4234-8234-123456789013",
  "operationId": "12345678-1234-4234-8234-123456789012",
  "marketStateId": "12345678-1234-4234-8234-123456789014",
  "proposalSource": "HUMAN_REQUEST",
  "decisionId": null,
  "humanRequestId": "12345678-1234-4234-8234-123456789015",
  "createdAt": "2026-10-20T10:00:00Z",
  "traceId": "4bf92f3577b34da6a3ce929d0e0e4736"
}
